ASW-G-08 Gundam Barbatos Lupus,https://gundam.fandom.com/wiki/ASW-G-08_Gundam_Barbatos_Lupus
ASW-G-08 Gundam Barbatos Lupus Rex,https://gundam.fandom.com/wiki/ASW-G-08_Gundam_Barbatos_Lupus_Rex
ASW-G-11 Gundam Gusion Rebake,https://gundam.fandom.com/wiki/ASW-G-11_Gundam_Gusion_Rebake
ASW-G-11 Gundam Gusion Rebake Full City,https://gundam.fandom.com/wiki/ASW-G-11_Gundam_Gusion_Rebake_Full_City
ASW-G-64 Gundam Flauros (Ryusei-Go),https://gundam.fandom.com/wiki/ASW-G-64_Gundam_Flauros_(Ryusei-Go)
ASW-G-01 Gundam Bael,https://gundam.fandom.com/wiki/ASW-G-01_Gundam_Bael
ASW-G-66 Gundam Kimaris,https://gundam.fandom.com/wiki/ASW-G-66_Gundam_Kimaris
ASW-G-66 Gundam Kimaris Trooper,https://gundam.fandom.com/wiki/ASW-G-66_Gundam_Kimaris_Trooper
ASW-G-XX Gundam Vidar,https://gundam.fandom.com/wiki/ASW-G-XX_Gundam_Vidar
ASW-G-66 Gundam Kimaris Vidar,https://gundam.fandom.com/wiki/ASW-G-66_Gundam_Kimaris_Vidar
ASW-G-29 Gundam Astaroth Origin (Manga only),https://gundam.fandom.com/wiki/ASW-G-29_Gundam_Astaroth_Origin
ASW-G-11 Gundam Gusion,https://gundam.fandom.com/wiki/ASW-G-11_Gundam_Gusion
ASW-G-29 Gundam Astaroth (Manga only),https://gundam.fandom.com/wiki/ASW-G-29_Gundam_Astaroth
ASW-G-47 Gundam Vual (Manga only),https://gundam.fandom.com/wiki/ASW-G-47_Gundam_Vual
MBF-C01 Command Astray Gundam,https://gundam.fandom.com/wiki/MBF-C01_Command_Astray_Gundam
NK-13 Cathedral Gundam,https://gundam.fandom.com/wiki/NK-13_Cathedral_Gundam
NYA+MBKF-P02 Nyaia Astray,https://gundam.fandom.com/wiki/NYA%2BMBKF-P02_Nyaia_Astray
RX-93 Nu Gundam Vrabe,https://gundam.fandom.com/wiki/RX-93_%CE%BD_Gundam_Vrabe
RX-93-Nu2V Hi-Nu Gundam Vrabe,https://gundam.fandom.com/wiki/RX-93-%CE%BD2V_Hi-%CE%BD_Gundam_Vrabe
RX-93-Nu2VA Hi-Nu Gundam Vrabe Amazing A&D,https://gundam.fandom.com/wiki/RX-93-%CE%BD2VA_Hi-v_Gundam_Vrabe_Amazing_A%26D
RX-93Nu-2I Hi-Nu Gundam Influx,https://gundam.fandom.com/wiki/RX-93%CE%BD-2I_Hi-%CE%BD_Gundam_Influx
ZGMF-X222 Nya Nyaia Gundam,https://gundam.fandom.com/wiki/ZGMF-X222Nya_Nyaia_Gundam
ZGMF-X1100L Nyaia Gundam Leone,https://gundam.fandom.com/wiki/ZGMF-X1100L_Nyaia_Gundam_Leone
F91 Gundam F91 Imagine,https://gundam.fandom.com/wiki/F91_Gundam_F91_Imagine
GAT-X105B Build Strike Gundam,https://gundam.fandom.com/wiki/GAT-X105B_Build_Strike_Gundam
GAT-X105B/FP Build Strike Gundam Full Package,https://gundam.fandom.com/wiki/GAT-X105B/FP_Build_Strike_Gundam_Full_Package
GAT-X105B/ST Star Build Strike Gundam,https://gundam.fandom.com/wiki/GAT-X105B/ST_Star_Build_Strike_Gundam
GAT-X105B/CM Build Strike Gundam Cosmos,https://gundam.fandom.com/wiki/GAT-X105B/CM_Build_Strike_Gundam_Cosmos
Nobel Gundam Deco,https://gundam.fandom.com/wiki/Nobel_Gundam_Deco
GX-9999 Gundam X Maoh,https://gundam.fandom.com/wiki/GX-9999_Gundam_X_Maoh
XM-X9999 Crossbone Gundam Maoh,https://gundam.fandom.com/wiki/XM-X9999_Crossbone_Gundam_Maoh
PPGN-001 Gundam Amazing Exia,https://gundam.fandom.com/wiki/PPGN-001_Gundam_Amazing_Exia
PPGN-001 Gundam Exia Dark Matter,https://gundam.fandom.com/wiki/PPGN-001_Gundam_Exia_Dark_Matter
RX-178B Build Gundam Mk-II,https://gundam.fandom.com/wiki/RX-178B_Build_Gundam_Mk-II
XXXG-01Wf Wing Gundam Fenice,https://gundam.fandom.com/wiki/XXXG-01Wf_Wing_Gundam_Fenice
XXXG-01Wfr Gundam Fenice Rinascita,https://gundam.fandom.com/wiki/XXXG-01Wfr_Gundam_Fenice_Rinascita
XXXG-01Wfr/A Gundam Fenice Rinascita Alba (Hobby Japan only),https://gundam.fandom.com/wiki/XXXG-01Wfr/A_Gundam_Fenice_Rinascita_Alba
Sengoku Astray Gundam,https://gundam.fandom.com/wiki/%E4%BE%8D%E3%83%8E%E5%BC%90_Sengoku_Astray_Gundam
BG-011B Build Burning Gundam,https://gundam.fandom.com/wiki/BG-011B_Build_Burning_Gundam
TBG-011B Try Burning Gundam,https://gundam.fandom.com/wiki/TBG-011B_Try_Burning_Gundam
KMK-B01 Kamiki Burning Gundam,https://gundam.fandom.com/wiki/KMK-B01_Kamiki_Burning_Gundam
LGZ-91 Lightning Gundam,https://gundam.fandom.com/wiki/LGZ-91_Lightning_Gundam
LGZ-91Fb Lightning Gundam Full Burnern,https://gundam.fandom.com/wiki/LGZ-91Fb_Lightning_Gundam_Full_Burnern
MSZ-006LGT Lightning Zeta Gundam,https://gundam.fandom.com/wiki/MSZ-006LGT_Lightning_Zeta_Gundam
MSZ-006LGT-3 Lightning Zeta Gundam Aspros (Hobby Japan only),https://gundam.fandom.com/wiki/MSZ-006LGT-3_Lightning_Zeta_Gundam_Aspros
SD-237 Winning Gundam,https://gundam.fandom.com/wiki/SD-237_Winning_Gundam
SD-237S Star Winning Gundam,https://gundam.fandom.com/wiki/SD-237S_Star_Winning_Gundam
Nobel M Gundam,https://gundam.fandom.com/wiki/Nobel_M_Gundam
Rising K Gundam,https://gundam.fandom.com/wiki/Rising_K_Gundam
GT-9600-DV Gundam Leopard da Vinci,https://gundam.fandom.com/wiki/GT-9600-DV_Gundam_Leopard_da_Vinci
MSN-001M Mega-Shiki,https://gundam.fandom.com/wiki/MSN-001M_Mega-Shiki
MSN-001G Gilla-Shiki (Hobby Japan only),https://gundam.fandom.com/wiki/MSN-001G_Gilla-Shiki
LM312V04 Amethyst Victory Gundam,https://gundam.fandom.com/wiki/LM312V04_Amethyst_Victory_Gundam
GT-9600-DV Gundam Leopard da Vinci,https://gundam.fandom.com/wiki/GT-9600-DV_Gundam_Leopard_da_Vinci
MSN-001M Mega-Shiki,https://gundam.fandom.com/wiki/MSN-001M_Mega-Shiki
MSN-001G Gilla-Shiki (Hobby Japan only),https://gundam.fandom.com/wiki/MSN-001G_Gilla-Shiki
LM312V04 Amethyst Victory Gundam,https://gundam.fandom.com/wiki/LM312V04_Amethyst_Victory_Gundam
RX-END Gundam The End,https://gundam.fandom.com/wiki/RX-END_Gundam_The_End
GN-9999 Transient Gundam,https://gundam.fandom.com/wiki/GN-9999_Transient_Gundam
GNW-100P Gundam Portent,https://gundam.fandom.com/wiki/GNW-100P_Gundam_Portent
Gundam Tryon 3,https://gundam.fandom.com/wiki/%E6%9C%80%E5%BC%B7%E6%A9%9F%E5%8B%95_Gundam_Tryon_3
Gundam Dryon Drei (Hobby Japan only),https://gundam.fandom.com/wiki/%E7%85%8C%E9%BB%92%E6%A9%9F%E5%8B%95_Gundam_Dryon_Drei
SDG-R1 Snibal Gundam,https://gundam.fandom.com/wiki/SDG-R1_Snibal_Gundam
SDG-R2 Dragonagel Gundam,https://gundam.fandom.com/wiki/SDG-R2_Dragonagel_Gundam
SDG-R3 Giracanon Gundam,https://gundam.fandom.com/wiki/SDG-R3_Giracanon_Gundam
Snibal-Drago-Gira,https://gundam.fandom.com/wiki/Snibal-Drago-Gira
NK-13J Denial Gundam,https://gundam.fandom.com/wiki/NK-13J_Denial_Gundam
GNY-003CL Gundam Abulhool Plus,https://gundam.fandom.com/wiki/GNY-003CL_Gundam_Abulhool_Plus
XM-X1 Crossbone Gundam X-1 Full Cloth Type.GBFT,https://gundam.fandom.com/wiki/XM-X1_Crossbone_Gundam_X-1_Full_Cloth
Cruel Gundam,https://gundam.fandom.com/wiki/Cruel_Gundam
PF-78-3A Gundam Amazing Red Warrior,https://gundam.fandom.com/wiki/PF-78-3A_Gundam_Amazing_Red_Warrior
"SD-9071A ""Kurenai Musha"" Red Warrior Amazing",https://gundam.fandom.com/wiki/SD-9071A_%22Kurenai_Musha%22_Red_Warrior_Amazing
WD-M01MS Turn A Gundam Shin,https://gundam.fandom.com/wiki/WD-M01MS_%E2%88%80_Gundam_Shin
XXXG-00W0CV Wing Gundam Zero Honoo,https://gundam.fandom.com/wiki/XXXG-00W0CV_Wing_Gundam_Zero_Honoo
XXXG-00W0FF Wing Gundam Zero Flame Feder,https://gundam.fandom.com/wiki/XXXG-00W0FF_Wing_Gundam_Zero_Flame_Feder
ZGMF-X09Ad Justice Gundam Dash,https://gundam.fandom.com/wiki/ZGMF-X09Ad_Justice_Gundam_Dash
ZGMF-X10AFF Freedom Gundam Flame Feder,https://gundam.fandom.com/wiki/ZGMF-X10AFF_Freedom_Gundam_Flame_Feder
